{
  "source_doc_token": "doccnDEMO0002",
  "source_node_token": "wikcnDEMO0002",
  "source_path": "通用知识/拆镜方法/动作单元",
  "source_title": "动作单元拆解",
  "scope": "general",
  "project_id": null,
  "obj_edit_time": "1760000000",
  "source_revision": 7,
  "card_count": 3,
  "last_synced_at": "2026-10-20T12:00:00+08:00",
  "last_sync_user": "demo-user",
  "last_run_id": "sync-20261020-120000"
}
